username,userid,twitter_name,display_name,display_country,gdelt_search,filename,bio
@MaithreepalaS,2911778245,Maithripala Sirisena,Maithripala Sirisena,Sri Lanka,WHERE Actor1Name CONTAINS 'Sirisena' AND Actor1CountryCode='LKA',,
@MichelKafando,2902429903,Michel kafando,Michel Kafando,Burkina Faso,WHERE Actor1Name CONTAINS 'kafando' AND Actor1CountryCode='BFA',,Office of the Interim President | Michel kafando | #Ouagadougou | #BurkinaFaso | #ECOWAS | #Africa
@French_Gov,2902364734,French Government,,France,,,French government's official twitter account for English speakers
@PresidentRuvi,2889520524,Reuven Rivlin,Reuven Rivlin,Israel,"WHERE Actor1Name=""REUVEN RIVLIN"" AND Actor1CountryCode='ISR'",,Follow for live updates from the 10th President of the State of Israel - Official Account
@BejiCEOfficial,2799385956,Beji Caid Essebsi,Beji Caid Essebsi,,,,الحساب الرسمي للباجي قائد السبسي الرئيس الخامس للجمهورية التونسية
@RuhakanaRugunda,2775336695,Ruhakana Rugunda,Ruhakana Rugunda,Uganda,"WHERE Actor1Name=""RUHAKANA RUGUNDA"" AND Actor1CountryCode='UGA'",,The PM of Uganda
@KlausIohannis,2765824141,Klaus Iohannis,,,,,
@GouvGabon,2706414134,Gouvernement Gabon,Ali Bongo Ondimba,Gabon,"WHERE Actor1Name=""ALI BONGO ONDIMBA"" AND Actor1CountryCode='GAB'",,Compte officiel du Gouvernment gabonais - Official account of the Gabonese Government
@APUkraine,2613887972,APU,,,,,"Офіційний твіттер 
Адміністрації Президента України
/ Administration of the President of Ukraine, 
Official Twitter"
@RashtrapatiBhvn,2597413135,President of India,Pranab Mukherjee,India,"WHERE Actor1Name=""Pranab Mukherjee"" AND Actor1CountryCode='IND'",,This is the official Twitter account of Rashtrapati Bhavan and is run by President’s Secretariat.  Tweets from the President are signed – President Mukherjee
@Andrej_Kiska,2558812321,Andrej Kiska,Andrej Kiska,Slovakia,,,Prezident Slovenskej republiky
@ProfMutharika,2545033486,Peter Mutharika,Peter Mutharika,Malawi,"WHERE Actor1Name=""PETER MUTHARIKA"" AND Actor1CountryCode='MWI'",,"Yale University,"
@hagegeingob,2515899612,Hage Geingob,Hage Geingob,Namibia,"WHERE Actor1Name=""HAGE GEINGOB"" AND Actor1CountryCode='NAM'",,Prime Minister of the Republic of Namibia
@CasaReal,2497155462,Casa de S.M. el Rey,Mariano Rajoy,Spain,"WHERE Actor1Name=""MARIANO RAJOY BREY"" AND Actor1CountryCode='ESP'",,Información e imágenes sobre la actividad de la Familia Real española y la Casa de S.M. el Rey. Normas de uso http://www.casareal.es/ES/Paginas/NormasTW.aspx …
@Kolo_Roger,2476339505,Kolo Roger,Kolo Roger,Madagascar,,,Premier Ministre Malgache
@govgeoabkhaz,2470587673,Қырҭтәыла Аиҳабыра,Irakli Garibashvili,Georgia,,,"Official Twitter Channel of Georgian Government in
Abkhaz Language"
@NauruBwiema,2442197798,Baron Waqa,Baron Waqa,Nauru,,,President of Nauru since 2013
@PresidencySrb,2440554602,Presidency of Serbia,Tomislav Nikolić,Serbia,,,This is the official account of the Presidency of Serbia. This account is managed by the Presidency media team.
@JapanGov,2428796856,The Gov't of Japan,Shinzō Abe,Japan,WHERE Actor1Name='Shinzo Abe' AND Actor1CountryCode='JPN',,Official Twitter of the Government of Japan
@poroshenko,2423747006,Петро Порошенко,Petro Poroshenko,Ukraine,,,"Президент України,                                                                                           The President of Ukraine"
@AlsisiOfficial,2419191913,Abdelfattah Elsisi,Abdel Fattah El-Sisi,Egypt,,,الحساب الرسمي للرئيس/عبدالفتاح السيسي                          رئيس جمهورية مصر العربية
@PresidenceMada,2407830288,PrésidenceMadagascar,Hery Rajaonarimampianina,Madagascar,"WHERE Actor1Name=""HERY RAJAONARIMAMPIANINA"" and Actor1CountryCode='MDG'",,Compte Twitter Officiel de la Communication de la Présidence de la République de Madagascar
@skngov,2389574116,SKN Government,,,,,The official Twitter account of the government of St. Kitts and Nevis.
@Mapon_Matata,2349940394,MATATA PONYO Mapon,Augustin Matata Ponyo,Democratic Republic of the Congo,WHERE Actor1Name='MATATA PONYO MAPON' AND Actor1CountryCode='COD',,Premier Ministre de la République Démocratique du Congo
@TommyRemengesau,2349626330,"Tommy Remengesau, Jr",,,,,"Alii and welcome to the official Twitter account for the President of the Republic of #Palau-- Tommy E. Remengesau, Jr.!"
@DrAAbdullah,2329127093,Abdullah Abdullah,,,,,Chief Executive of the Islamic Republic of Afghanistan
@HassanalBolkia2,2322232166,Hassanal Bolkiah,,,,,This twitter account is controlled by a spokesman for the sultan Brunei Darussalam
@Khamenei_ar,2247047317,الإمام الخامنئي,,,,,الموقع الإعلامی لمکتب حفظ و نشر آثار سماحة آية الله العظمى السيد علي الخامنئي
@Mehdi_Jomaa,2246134207,Mehdi Jomaa,,,,,مهدي جمعة رئيس الحكومة التونسية - Mehdi Jomaa Chef du gouvernement tunisien
@FlorenceGuillau,2244362226,Florence Guillaume,,,,,
@MargvelashviliG,2243475914,President Of Georgia,,,,,"President of Georgia Giorgi Margvelashvili was elected on October 27, 2013 with more than 62% of the vote"
@GovernmentGeo,2228188470,GeorgianGovernment,,,,,Official Twitter Channel of Georgian Government
@SushilKoiralaNC,2224100184,Sushil Koirala,Sushil Koirala,Nepal,,,37th Prime Minister of Nepal and President of @NepaliCongress Party.
@govSlovenia,2193752173,Slovenian Government,,,,,Official English language Twitter account of the Government of the Republic of Slovenia. | Slovenski profil @vladaRS
@SkerritR,2168930017,Roosevelt Skerrit,,,,,Prime Minister of the Commonwealth of Dominica
@PresYameen,1951275630,Abdulla Yameen,,,,,"The Official Twitter of the President of the Republic of Maldives, His Excellency Abdulla Yameen Abdul Gayoom"
@Yatsenyuk_AP,1896985040,Arseniy Yatsenyuk,,,,,Прем’єр-міністр України.
@FijiGovernment,1674155761,Fiji Government,,,,,The official twitter account of the Fijian Government
@maduro_en,1660469318,Nicolás Maduro,Nicolás Maduro,Venezuela,WHERE Actor1Name='NICOLAS MADURO MOROS' AND Actor1CountryCode='VEN',,President of the Bolivarian Republic of Venezuela. Son of Chávez. Building the Homeland with revolutionary efficiency. English translation of @NicolasMaduro
@MiroCerar,1655801280,dr. Miro Cerar,,,,,Prime Minister of the Republic of Slovenia / Uradni račun predsednika Vlade Republike Slovenije dr. Mira Cerarja in predsednika stranke SMC. Zanj tvita ekipa.
@MonarchieBe,1626202080,Belgian Royal Palace,,,,,"Officieel Twitter-kanaal van het Koninklijk Paleis, België - Compte Twitter officiel du Palais Royal, Belgique"
@PMOComms,1623929238,PMOCOMMS,,,,,Only Official Account for the Somali Prime Minister  Communications Office (2014)
@casacivilbr,1623608509,Casa Civil,,,,,Perfil oficial da Casa Civil da Presidência da República
@MZemanOficialni,1618506558,Miloš Zeman,,,,,
@PSCU_Digital,1595205038,PSCU Kenya Digital,,,,,Embracing the digital age! The Home of Presidential and Government News
@GovernmentZA,1536223580,South African Gov,,,,,"The official South African Government account, offering easy access to public information and services. E-mail: socialmedia@gcis.gov.za Tel: 0860 428 392"
@RamiHamdalla,1494909290,Rami Hamdallah,,,,,Office Page of Prime Minister Dr. Rami Hamdallah
@Malaysia_Gov,1491523212,Malaysia Government,,,,,Malaysia is a federal constitutional monarchy consisting of 13 States and 3 Federal Territories. RTs do not equal endorsement.
@IurieLeanca,1479879036,Iurie Leancă,,,,,"Contul oficial de Twitter al Prim-ministrului Republicii Moldova.
Profil administrat de către Iurie Leancă şi echipa @PLDMoldova."
@presedinte_md,1472196571,Nicolae Timofti,,,,,Președintele Republicii Moldova / The President                                 of Republic of Moldova
@PrimatureRDC,1446574225,PrimatureRDC,,,,,Compte twitter officiel de la Primature de la République Démocratique du Congo / Facebook: http://goo.gl/FMTxy
@HassanRouhani,1404590618,Hassan Rouhani,,,,,Iranian President's Sole English Account ¦ Persian @Rouhani_ir ¦ media@rouhani.ir
@Rouhani_ir,1371618385,دکتر حسن روحانی,,,,,دکتر حسن روحانی رییس جمهوری اسلامی ایران    -                         English Account @HassanRouhani
@RHCJO,1362191299,RHC,,,,,"الديوان الملكي الهاشمي - The Royal Hashemite Court.
 تغريدات جلالة الملك عبدالله الثاني تنتهي بـ
Tweets from His Majesty King Abdullah II are signed #ABH"
@Presidency_Sy,1353802260,Syrian Presidency,,,,,"This is the official Twitter account for the Presidency of the Syrian Arab Republic, offering updates on Presidential news and events."
@LibyaInterimGov,1319832283,الحكومة المؤقتة,,,,,Libya Interim Government الحكومة الليبية المؤقتة
@IstanaRakyat,1316012929,Istana untuk Rakyat,,,,,Istura adalah Akun resmi Istana untuk Rakyat. Sebuah wahana komunikasi dan berbagi informasi dari Istana Kepresidenan untuk mendekatkan rakyat dengan istananya.
@Ibrahim_Mahlab,1307285048,ابراهيم محلب,,,,,"Ibrahim Mahlab, Egypt's prime minister الحساب الرسمي"
@PrensaMichelle,1300716044,Prensa Michelle,,,,,"Este es el canal oficial del Departamento de Prensa de la Presidenta Electa, Michelle Bachelet."
@MPMCTweeter,1278739753,MPMC Tweeter,,,,,Ministry of Prime Minister & Cabinet for Samoa
@IsaMustafaRKS,1254508717,Isa Mustafa,,,,,Kryeministër i Republikës së Kosovës / Prime Minister of the Republic of Kosovo
@NicolasMaduro,1252764865,Nicolás Maduro,,,,,Presidente de la República Bolivariana de Venezuela. Hijo de Chávez. Construyendo la Patria con eficiencia revolucionaria.
@ZeljkoBiH,1218056936,Željko Komšić,,,,,Član Predsjedništva BiH
@CYpresidency,1165728211,Προεδρία της ΚΔ,,,,,"Προεδρία της Κυπριακής Δημοκρατίας/ 
Presidency of the Republic of Cyprus/
Kıbrıs Cumhuriyeti Cumhurbaşkanlığı;
see also @AnastasiadesCY"
@Presidencia_HN,1145775630,Casa Presidencial,,,,,Cuenta Oficial de la Casa Presidencial de Honduras.
@SomaliPM,1144935463,@SomaliPM,,,,,"Official Twitter account of the Somalia Prime Minister His Excellency
Omar Abdirashid Ali Sharmarke. Re-tweet doesn't mean endorsement. Views are my own."
@brunei_pmo,1120940742,Brunei PMO,,,,,The Official twitter account of Prime Minister's Office of Brunei Darussalam.
@SassouCG,1106069527,Denis Sassou Nguesso,,,,,Compte Twitter Officiel du Président de la République du #Congo
@pmoffice_mn,1091577991,PM's office,,,,,Ерөнхий сайдын ажлын алба
@HRHPSalman,1072915220,سلمان بن عبدالعزيز,,,,,الحساب الرسمي لصاحب السمو الملكي الأمير / سلمان بن عبدالعزيز آل سعود ، ولي العهد نائب رئيس مجلس الوزراء وزير الدفاع في المملكة العربية السعودية
@ebkoroma,1069973798,Ernest Bai Koroma,,,,,"I am Ernest Bai Koroma, President of the Republic of Sierra Leone. I became President of Sierra Leone in 2007 and I was re-elected for a second term - Nov. 2012"
@StateHouseSey,1057428702,SeychellesStateHouse,,,,,The Office of the President of the Republic of Seychelles presents news concerning President James Michel and Seychelles national news.
@EgyPresidency,1055385086,Egyptian Presidency,Abdel Fattah el-Sisi,Egypt,,,Follow us for the latest news about the Egyptian Presidency
@uredprh,1049824686,Ured predsjednika RH,,,,,Službeni twitter account ureda Predsjednika Republike Hrvatske.
@samoagovt,1016451774,Government of Samoa,,,,,Official Page of the Press Secretariat of the Government of Samoa | Tweets by Press Secretariat staffer @Renate_Rivers |
@IsraeliPM_heb,1015176121,ראש ממשלת ישראל,,,,,"החשבון הרשמי של משרד ראש הממשלה בעברית
http://www.pmo.gov.il"
@Israelipm_ar,1009434428,بنيامين نتنياهو,,,,,الحساب الرسمي بالعربية لرئيس الوزراء الاسرائيلي
@kyrgyzpresident,992876924,Президент КР,Almazbek Atambayev,Kyrgyzstan,WHERE Actor1Name='ALMAZ ATAMBAYEV' AND Actor1CountryCode='KGZ',,Официальные новости.Аппарат Президента Кыргызской Республики Алмазбека Атамбаева.Расмий жаңылыктар.Кыргыз Республикасынын Президентинин Аппараты.
@press_president,975960930,Press Office,,,,,"Follow @PresidentAM_eng, @PresidentAM_rus and @PresidentAM_arm for updates"
@PresidentAM_rus,975934998,President.am Press,,,,,Пресс служба Президента Республики Армения
@PresidentAM_eng,975927512,President.am Press,,,,,Press Office of the President of the Republic of Armenia
@Daniel_k_Duncan,965823858,Daniel Kablan DUNCAN,,,,,
@Pontifex_pt,965741665,Papa Francisco,,,,,Bem-vindo ao Twitter oficial de Sua Santidade Papa Francisco
@Pontifex_ar,965706379,البابا فرنسيس,,,,,أهلاً بكم في الصفحة الرسمية تويتر لقداسة البابا فرنسيس
@Pontifex_ln,965704518,Papa Franciscus,,,,,Tuus adventus in paginam publicam Papae Francisci breviloquentis optatissimus est.
@Palazzo_Chigi,963938472,Palazzo_Chigi,,,,,Profilo ufficiale della Presidenza del Consiglio dei Ministri. Governo italiano.
@ts_elbegdorj,963395250,President's Office,,,,,"Монгол Улсын Ерөнхийлөгчийн Тамгын газар |
Office of the President of Mongolia"
@Grybauskaite_LT,961974776,Dalia Grybauskaitė,,,,,President of the Republic of Lithuania
@gouvernementFR,951480480,Gouvernement,,,,,Twitter officiel du Gouvernement français.
@somaligov_,950484104,SOMALI   GOVERMENT,,,,,
@TheVillaSomalia,950313240,Villa Somalia,,,,,This is the official Twitter of Villa Somalia.
@PMNawazSharif,937710709,Mian Nawaz Sharif,,,,,PM Nawaz Sharif on Twitter
@PresidentKosovo,933003422,Atifete Jahjaga,,,,,President of the Republic of Kosovo
@PutinRF_Eng,932196612,Vladimir Putin,Vladimir Putin,Russia,WHERE Actor1Name='VLADIMIR PUTIN' or Actor1Name='VLADIMIR VLADIMIROVICH PUTIN' AND Actor1CountryCode='RUS',,The official twitter channel for President of the Russian Federation. Tweets from the President are signed #VP
@ortcomkzE,927294824,ortcomkzE,,,,,Central Communications Office for the President of Kazakhstan
@ortcomkz,926894935,ortcomkz,,,,,СЦК создана для улучшения взаимодействия между государственными органами и СМИ
@KoupakiOfficiel,923449368,Pascal I. Koupaki,,,,,:: Compte Officiel de Pascal I. Koupaki :: Economiste et homme politique béninois. Premier Ministre du #BENIN de 2011 à 2013
@GovCyprus,886930609,Cyprus Portal,,,,,Official twitter account of the Web Portal of the Rep. of Cyprus Inappropriate comments will be blocked
@rubirivlin,886335560,ראובן (רובי) ריבלין,,,,,
@Al_Kasbah,881162107,Alkasbah,,,,,رئاسة الحكومة  - http://www.alkasbah.tn
@vladaOCDrs,857883481,Kancelarija za OCD,,,,,Kancelarija za saradnju sa civilnim društvom Vlade Republike Srbije. Stvaramo podsticajno okruženje za #OCDrs (organizacije civilnog društva u Srbiji)
@KhaledBahah,851181762,Khaled Bahah,,,,,Permanent Representative of Yemen to the United Nation
@MoussaMara2,850685436,Moussa Mara,,,,,"Premier Ministre du Mali, Expert Comptable de Formation, Président du parti Politique YELEMA(LE CHANGEMENT)."
@PRepublicaTL,845048838,Taur Matan Ruak,,,,,
@zasagmn,806124644,zasag,,,,,МОНГОЛ УЛСЫН ЕРӨНХИЙ САЙД Н.АЛТАНХУЯГИЙН ТЭРГҮҮЛСЭН ШИНЭЧЛЭЛИЙН ЗАСГИЙН ГАЗАР
@StateHouseSL,782308724,State House,,,,,"Office of the President of Sierra Leone. Tweets by @CommsUnitSL managed by @jaraski. 
http://www.facebook.com/StateHouseSL"
@ChefGov_ma,748291920,عبد الإله ابن كيران,,,,,رئيس الحكومة
@BgPresidency,737550788,Bulgarian Presidency,,,,,Administration of the Bulgarian President - Press Office/Администрация на Президента
@QuirinaleStampa,732819391,Quirinale Uff Stampa,,,,,Twitter ufficiale dell'Ufficio Stampa della Presidenza della Repubblica.
@JDMahama,726748106,John Dramani Mahama,,,,,"Official account of H.E. John Dramani Mahama, President of the Republic of Ghana, run by staff. Tweets by H.E. are signed– JM. http://www.presidency.gov.gh"
@AkordaPress,635586094,Пресс-служба Акорды,,,,,Қазақстан Республикасы Президентінің Баспасөз қызметі               Press Office of The President of the Republic of Kazakhstan
@Pravitelstvo_RF,634725546,Правительство России,,,,,Новости о Председателе Правительства России и Правительстве России. Английская версия аккаунта - @GovernmentRF
@BorutPahor,634463033,Borut Pahor,,,,,"Uradni račun predsednika Republike Slovenije Boruta Pahorja. Tvita ekipa, tviti PRS označeni z BP/Official channel of the President of the Republic of Slovenia"
@GovernmentRF,633794939,Government of Russia,Dmitry Medvedev,Russia,WHERE Actor1Name='DMITRIY MEDVEDEV' AND Actor1CountryCode='RUS',,"Follow news on the work of the Prime Minister and the Russian Government in English. For tweets in Russian, follow @Pravitelstvo_RF"
@GeorgianGovernm,632907601,Georgian Government,,,,,
@MahamadouIssouf,623290235,Mahamadou Issoufou,,,,,Président de la république du Niger
@Matignon,621874680,Matignon,,,,,"Bienvenue sur le compte officiel du Premier ministre français, chef du gouvernement. Compte géré par le cabinet. Suivez aussi @gouvernementFR"
@Straujuma,619870515,Laimdota Straujuma,,,,,Latvijas Republikas Ministru prezidente / Prime Minister of the Republic of Latvia
@VBevanda,611770712,Vjekoslav Bevanda,,,,,
@KBZayed,611109758,خليفة بن زايد,,,,,"شاركنا حبك للقائد { مبادرة } . *باذن الله عندما يصل عدد المتابعين لـ مليون سنقدمه كـ هدية لـ رئيس الدولة .
http://instagram.com/KBZayed 
kik : H.kbzayed"
@primatureci,606309435,Le Premier Ministre,,,,,
@SerbianGov,603524800,Serbian Government,,,,,"Official Twitter account of the Government of the Republic of Serbia in English. We welcome your suggestions, questions ..."
@emansionliberia,603417503,Executive Mansion,,,,,The official Twitter page of the President of the Republic of Liberia
@Sekhoutoureya,600418108,Présidence de Guinée,,,,,Bienvenue sur le compte Twitter officiel de la Présidence de la République de Guinée.
@SalamTammam,599985251,Tammam Salam,,,,,The official twitter account of the Prime Minister of Lebanon Tammam Salam
@MaldivesPO,594963354,President's Office,,,,,News and updates from the President’s Office about the changes\developments made by the government of Maldives. Comments & messages received maybe archived.
@PrensaHC,594051718,PrensaHC,,,,,Cuenta oficial del equipo de prensa del Presidente Constitucional de la República del Paraguay @Horacio_Cartes.
@predsednikrs,589069254,Томислав Николић,,,,,Званична презентација председника Републике Србије на Твитеру. Твитови председника почињу са ТН:
@presidenciaCV,580037845,Jorge Carlos Fonseca,,,,,"Bio: President of the Republic of Cape Verde.
https://wdv24e.s.cld.pt"
@IlvesToomas,579747564,toomas hendrik ilves,,,,,vaata kodukalt/look at my homepage
@presstj,579483133,presstj,,,,,
@HadiPresident,570223846,عبدربه  منصور هادي,,,,,
@AnastasiadesCY,568981074,Nicos Anastasiades,,,,,"Νίκος Αναστασιάδης, Πρόεδρος της Κυπριακής Δημοκρατίας/ President of the Republic of Cyprus; see also @CYpresidency"
@SaintLuciaGov,547314961,St. Lucia Government,,,,,Government of Saint Lucia Twitter Account
@PresidentAM_arm,545885877,President.am Press,,,,,Հայաստանի Հանրապետության Նախագահի մամլո ծառայություն
@PMTCHAD,532423452,Primature du Tchad,,,,,Compte Twitter Officiel de la Primature de la République du Tchad.
@Nicolae_Timofti,528997120,Nicolae Timofti,,,,,Președintele Republicii Moldova
@Pontifex_es,525264466,Papa Francisco,,,,,Bienvenido al Twitter oficial de Su Santidad Papa Francisco
@StateHousePress,525120064,StateHouse PressZM,,,,,The State House Press Office is one of the offices of Five Special Assistants attending to the President of Zambia.
@luisguillermosr,524571803,Luis Guillermo Solís,,,,,Primer Servidor de la República de Costa Rica 2014 - 2018
@jammehofficial,523491641,Prof. Yahya Jammeh,,,,,President of the Republic of The Gambia
@Pontifex_de,523150102,Papst Franziskus,,,,,Willkommen auf der offiziellen Twitter-Seite Seiner Heiligkeit Papst Franziskus
@Pontifex_pl,522122949,Papież Franciszek,,,,,Witamy na oficjalnej stronie Twitter Jego Świątobliwości Papieża Franciszka
@Pontifex_fr,500713106,Pape François,,,,,Bienvenue sur la page Twitter officielle du Pape François
@Pontifex_it,500711588,Papa Francesco,,,,,Benvenuti alla pagina Twitter ufficiale di Sua Santità Papa Francesco
@Pontifex,500704345,Pope Francis,,,,,Welcome to the official Twitter page of His Holiness Pope Francis
@GuatemalaGob,495102115,Gobierno Guatemala,,,,,Noticias e información del Gobierno de Guatemala.
@BaldwinSpencer,484178775,Baldwin Spencer,,,,,
@BdiPresidence,482242599,Burundi | Présidence,,,,,
@GvtMonaco,472167838,Gouvernement Monaco,,,,,Bienvenue sur le compte officiel du Gouvernement de la Principauté de Monaco
@PMOIndia,471741741,PMO India,,,,,Office of the Prime Minister of India
@MBZNews,471010707,أخبار محمد بن زايد,,,,,حساب تويتر الرسمي لأخبار سمو الشيخ محمد بن زايد آل نهيان The official twitter account for the news of HH Mohamed bin Zayed Al Nahyan
@AbeShinzo,468122115,安倍晋三,,,,,衆議院議員安倍晋三（あべしんぞう）の公式twitterです
@micwebTonga,467314261,micwebTonga,,,,,Tonga Government Portal website/ Prime Minister Office/ Ministry of Information and Communications
@presidenceTN,455895084,تونس - الرئاسة,,,,,الحساب الخاص برئاسة الجمهورية التونسية على تويتر
@SaikhanbilegCh,454739210,Saikhanbileg,,,,,"Улсын Их Хурлын гишүүн, УИХ дахь АН-ын бүлгийн ахлагч"
@VladaCG,450605189,Vlada Crne Gore,,,,,"Zvanični nalog Vlade Crne Gore. Zvanične informacije.
#CrnaGora"
@VladaRH,444097675,Vlada R. Hrvatske,,,,,Vlada RH - službeni Twitter račun. Government of the Republic of Croatia - official Twitter account. Pravila korištenja: http://bit.ly/1syf0Qk
@PrimatureRwanda,440647714,Primature,,,,,The Office of the Prime Minister of Rwanda
@PSimpsonMiller,440460647,Portia SimpsonMiller,,,,,Portia Simpson-Miller is the leader of the People's National Party and Jamaica's first female Prime Minister.
@PutinRF,438133358,Владимир Путин,,,,,Официальный аккаунт поддержки Президента Российской Федерации Владимира Путина. Личные сообщения отмечены #ВП
@A_Davutoglu_ar,434882299,Ahmet Davutoğlu,,,,,"الصفحة الرسمية لرئيس الوزراء التركي ورئيس حزب العدالة والتنمية أحمد داوود أوغلو على موقع تويتر 
Türkçe:@Ahmet_Davutoglu  -  English: @A_Davutoglu_eng"
@A_Davutoglu_eng,434829567,Ahmet Davutoğlu,,,,,Prime Minister of Republic of Turkey - Chairman of AK PARTY
@TaaviRoivas,422049167,Taavi Rõivas,,,,,"Peaminister, liberaal, spordifänn"
@mincombolivia,415816193,Min. de Comunicacion,,,,,El Ministerio de Comunicación fue creado mediante Decreto Supremo N° 0793 del 15 de febrero de 2011.
@ARG_AFG,413756746,ارګ,,,,,This is an Official Account of Presidential Palace of Afghanistan
@kantei,412940784,首相官邸,,,,,本アカウントは首相官邸の公式アカウントです。首相官邸（災害情報）ツイッターに加えて、日々の情報も国民の皆様に発信します。首相官邸ＨＰに掲載される総理についての更新情報などを中心にお届けします。
@UgandaMediaCent,398537661,Uganda Media Centre,,,,,The Government of Uganda's Official centre for Public Communications
@DonaldRamotar,397237197,Donald Ramotar,,,,,Presidential Candidate People's Progressive Party
@UAEGover,395556077,UAE Government,,,,,مشروع توحيد دولة الإمارات العربية المتحده الكترونيا
@FijiPM,395425451,JV Bainimarama,,,,,"The office of Josaia Voreqe Bainimarama, Prime Minister of the Republic of Fiji"
@FijiRepublic,393086391,Republic of Fiji,,,,,
@IBK_2013,391694893,Ibrahim B. Keita,,,,,Président de la République du #Mali. https://www.facebook.com/IBK.Officiel
@PrimeMinisterGE,390860839,Irakli Garibashvili,,,,,Official twitter channel of the Prime Minister of Georgia
@PresidenceMali,389486048,Presidence Mali,,,,,Fil officiel de la Présidence de la République du #Mali
@eng_pm_kz,389272165,PM KZ,,,,,English-language twitter account of the official site of the Prime Minister of Kazakhstan @KarimMassimov_E
@kaz_pm_kz,389265641,PM KZ,,,,,ҚР Премьер-Министрі ресми сайтының қазақ тіліндегі твиттер-аккаунты @KarimMassimov
@PMKamla,388639092,Kamla P. Bissessar,,,,,Official Twitter page of the Prime Minister of the Republic of Trinidad and Tobago.
@VladaMK,382673029,Влада на Македонија,,,,,"ВЛАДА НА РЕПУБЛИКА МАКЕДОНИЈА
http://www.facebook.com/VladaMK 
http://www.youtube.com/VladaMakedonija"
