username,userid,twitter_name,display_name,display_country,gdelt_search,filename,bio
@niinisto,37665086,Sauli Niinistö,,,,,Tämä on Sauli Niinistön virallinen Twitter-tili. Sauli merkkaa omat viestinsä SN
@PaulKagame,37601149,Paul Kagame,,,,,"President of the Republic of Rwanda, write to: paulkagame@gov.rw"
@QueenRania,36412963,Rania Al Abdullah,,,,,A mum and a wife with a really cool day job...
@alexstubb,36048614,Alexander Stubb,,,,,Prime Minister of Finland. Chairman of Kokoomus. Eternal optimist. Sub 10h Ironman. What you tweet is what you get.
@BritishMonarchy,36042554,BritishMonarchy,,,,,"Updates, pictures and videos from Buckingham Palace about the work and activities of The Royal Family and the institution of Monarchy."
@Statsmin_kontor,36028993,SMK,,,,,Statsministerens kontor bistår statsministeren i å lede og samordne arbeidet i regjeringen.
@DaniloMedina,35485571,Danilo Medina,,,,,"Presidente constitucional de la República Dominicana. Comprometido con construir un país de oportunidades y bienestar. Padre de 3 bellas hijas, esposo de Candy."
@PresidenciaMX,34666670,Presidencia México,,,,,Oficina de la Presidencia de la República 2012 - 2018.
@leehsienloong,34568673,Lee Hsien Loong,,,,,"Official Twitter account of the Prime Minister of Singapore, maintained by the Prime Minister's Office. Tweets by Mr Lee are signed LHL."
@govpt,31237480,Governo de Portugal,,,,,
@WhiteHouse,30313925,The White House,,,,,Follow for the latest from President Obama and his administration. Tweets from the President are signed –bo. Tweets may be archived: http://wh.gov/privacy .
@JosephMuscat_JM,29466039,Joseph Muscat,,,,,Prime Minister and Leader of the Labour Party - Malta. This profile is run by the PL campaign team. Personal tweets by Joseph Muscat are signed -JM.
@govtofgeorgia,29242264,Republic of Georgia,,,,,Gov. of Georgia
@Kronprinsparet,28101138,Det kongelige hoff,,,,,Official twitter stream on behalf of Their Royal Highnesses The Crown Prince and Crown Princess of Norway
@khamenei_ir,27966935,Khamenei.ir,,,,,"Follow for regular updates and news about Ayatollah Seyed Ali Khamenei, Iran's Supreme Leader ---
Arabic Account: @khamenei_ar"
@guv_ro,27864636,Guvernul României,,,,,
@wernerfaymann,26380221,Werner Faymann,,,,,
@TabareVazquez,25517917,Tabare Vazquez,,,,,Presidente de la Republica Oriental del Uruguay
@GjorgeIvanov,19693272,GjorgeIvanov,,,,,
@passoscoelho,19689047,Pedro Passos Coelho,,,,,"Canal do presidente do PSD no twitter. Notícias, agenda, e declarações políticas."
@narendramodi,18839785,Narendra Modi,,,,,Prime Minister of India
@fhollande,18814998,François Hollande,,,,,Président de la République française
@matteorenzi,18762875,Matteo Renzi,,,,,Presidente del Consiglio dei Ministri. Segretario del PD
@NoticiaCR,18710706,La Noticia CR,,,,,"Contacto Directo del Gobierno de Costa Rica
https://www.facebook.com/LaNoticiaCR"
@johnkeypm,17380167,John Key,,,,,"Prime Minister of New Zealand and Leader of the NZ National Party. Authorised by John Key MP, Executive Wing, Parliament, Molesworth Street, Wellington"
@presidencia,17311493,Presidência,,,,,Twitter Oficial da Presidência da República Portuguesa
@netanyahu,17061263,בנימין נתניהו,,,,,"העמוד הרשמי של יו''ר הליכוד וראש הממשלה, בנימין נתניהו"
@Elysee,16717501,Élysée,,,,,Bienvenue sur le compte officiel de la Présidence de la République française et du Palais de l'Élysée. Livetweets à suivre sur #DirectPR .
@erna_solberg,16432083,Erna Solberg,,,,,"Statsminister i Norge. Jobber for et samfunn med muligheter for alle.
For saker til forvaltningen, henvend deg til rette myndighet for saksbehandling."
@NajibRazak,16389180,Mohd Najib Tun Razak,,,,,"Prime Minister of Malaysia, working towards a #BetterNation"
@premierministre,15895464,Stephen Harper,,,,,Premier ministre du Canada. Follow me in English: @pmharper
@Rijksoverheid,15595333,Rijksoverheid,,,,,De Rijksoverheid beantwoordt uw vragen over wet- en regelgeving | ma-vr 8.00-20.00 | Geen persoonlijke gegevens | Twitterbeleid op http://rijksoverheid.nl/contact
@Regering,15595166,Regering,,,,,
@Number10gov,14224719,UK Prime Minister,,,,,"The official Twitter channel for Prime Minister David Cameron's office, based at 10 Downing Street. Read social media policy: http://bit.ly/No10-social-media …"
@pmharper,7401202,Stephen Harper,,,,,"Prime Minister of Canada. 

Suivez-moi en français à @premierministre."
@EPN,2897441,Enrique Peña Nieto,,,,,Presidente de los Estados Unidos Mexicanos.
@BarackObama,813286,Barack Obama,Barack Obama,United States,WHERE Actor1Name='Obama' OR Actor1Name='BARACK OBAMA' AND Actor1CountryCode='USA',,This account is run by Organizing for Action staff. Tweets from the President are signed -bo.